Id,TitleName,Description,ReleaseYear,AgeCertification,Runtime,ProductionCountry,Seasons
1,Ut voluptatem sunt.,Asperiores corporis quo eius placeat amet fugiat blanditiis modi itaque dolorum mollitia repudiandae magni voluptatum.,1935,S,205,SO,
2,Cum quia itaque.,Et molestiae consequatur rerum ipsum minima rerum illo et autem assumenda aut ut fugit debitis.,1994,X18,190,MW,
3,Quas voluptatem eos.,Ipsum sit natus temporibus est repellat quia ad a eum id nam necessitatibus molestiae repellendus.,1905,18,162,UZ,8
4,Et doloremque quam.,Voluptatem nostrum corrupti sint hic quidem et qui fugit corporis porro tenetur dolore a at.,1972,R21,137,MU,
5,Voluptatem reprehenderit assumenda.,Omnis laboriosam praesentium facere quis ut laudantium deserunt explicabo itaque similique qui cum sit aspernatur.,1907,M/PG,151,ER,
6,Amet qui tempora.,Voluptatem sunt eos harum quibusdam sed eum et voluptatum vel et error minima voluptas suscipit.,1985,M/PG,135,JP,
7,Nostrum occaecati et.,Eos suscipit id dolor debitis molestias qui odit alias eius et quas distinctio nulla atque.,1959,AL,188,GM,
8,Unde ipsum nihil.,Tempore aspernatur recusandae corrupti officiis laboriosam nesciunt quis et non autem temporibus suscipit tempora repellendus.,1902,R,151,EH,9
9,Vero laboriosam aut.,Et et quo et aliquid earum quisquam sunt tempore officia illo in quos rerum voluptatem.,1944,12,229,CR,
10,Amet porro temporibus.,Dolorem esse in odio est quia libero sed sit doloremque aut in molestiae dicta asperiores.,2008,PG-13,234,HT,
11,Est sit impedit.,Ut vel nihil omnis est voluptas ut qui sunt aut vero quibusdam eos debitis iusto.,1981,15,179,TD,
12,Enim dolor incidunt.,Sunt earum voluptatibus accusantium voluptatem consequuntur odio aut cum ex sapiente perspiciatis ut doloribus ut.,1954,TV-Y,150,BJ,
13,Numquam ea vero.,Sapiente explicabo nam similique nihil architecto et et sint quasi quia vel sequi error ut.,2016,18R,203,AG,8
14,Hic fugiat nobis.,Corporis minima nostrum atque dignissimos repudiandae placeat qui quia illo non ut et qui dolor.,2009,NC-17,187,GW,
15,Rerum facere aut.,Sit quos quasi voluptatem ut ut perferendis aperiam officiis tempora maiores iusto beatae inventore laboriosam.,2007,18,115,TN,
16,Officiis sit neque.,Alias esse voluptatem est et et sunt quidem ea voluptate laborum ipsam deserunt in dignissimos.,1977,TV-PG,95,ES,
17,Facilis sed esse.,Officiis eos sunt sed odio aliquam iusto quidem sunt veritatis est dolores beatae expedita ipsam.,1990,C,94,BG,
18,Id hic quia.,Eos et consequatur accusantium nam qui eius aliquid esse aut consequatur eos at sint voluptatem.,2016,TV-14,101,VG,
19,Natus maiores assumenda.,Et asperiores deleniti maiores tenetur voluptas nulla aliquid quo ullam eius qui quae eveniet non.,1968,R21,88,MD,
20,Culpa maxime labore.,Quibusdam velit iste ea est necessitatibus voluptatum autem animi voluptatum modi sint in quae numquam.,1981,E10+,112,CH,
21,Exercitationem harum beatae.,Porro non fugit ullam quia dolores ea neque delectus dolores libero qui error est nihil.,1983,E,182,IO,
22,Et adipisci debitis.,Dolor neque quaerat non dolores doloribus est ex repellat dolor eos est vero et est.,1966,A,81,LU,
23,Voluptates similique iure.,Quae pariatur sit ut quam accusamus iure libero est debitis pariatur vel enim vel qui.,1964,E10+,101,GL,4
24,Temporibus et sit.,Facere labore aut suscipit vel eligendi quae non rerum et debitis in dicta nostrum occaecati.,2014,R21,141,ER,
25,Dicta nisi maiores.,Mollitia quia sed qui qui eligendi consectetur rerum suscipit est dolores quis cumque molestiae inventore.,1934,TV-14,82,MH,
26,A consequuntur asperiores.,Unde ut itaque ullam cum et repellat culpa voluptatem quia necessitatibus modi labore necessitatibus dolorum.,1997,A,89,IO,
27,Fugit dolorem voluptate.,Esse inventore odio eligendi incidunt mollitia placeat non sunt eaque possimus eius vero porro qui.,1964,R,193,RU,9
28,Necessitatibus numquam et.,Ut quia asperiores excepturi aut quisquam dolores inventore molestiae a rerum magnam in dolor dolor.,1924,CA,105,RE,
29,Et consequatur officia.,Eum corporis aut corrupti sit odit hic ut voluptatibus omnis cum et asperiores voluptatem eligendi.,1996,R21,148,SV,
30,Quasi animi sit.,Aut eos quas aliquid nesciunt iusto numquam voluptatem possimus et itaque delectus excepturi eveniet impedit.,1979,U,204,DE,1
31,Blanditiis nesciunt eos.,In aut voluptatum tempora possimus aperiam in consequatur non cumque est voluptate est officia voluptatem.,1991,EC,99,MZ,4
32,Soluta consectetur odio.,Quia in earum nihil cupiditate incidunt nostrum dolorem quibusdam sequi aut iure et ipsa voluptatibus.,1947,12A,153,IS,
33,Sapiente quos iste.,Autem laboriosam numquam repellendus sed odio placeat maiores animi velit non quo perspiciatis recusandae ab.,1945,G,89,MS,
34,Qui sit quia.,Est at dolores commodi nihil et veniam odit cupiditate veniam voluptas unde accusamus consequuntur non.,1929,12A,133,VC,
35,Eius maiores explicabo.,Eaque ab et et qui voluptas commodi ut quas ullam deserunt aspernatur et consectetur sequi.,1907,PG,153,LR,
36,Ut illo est.,Nostrum omnis aut ea cum magnam nihil a inventore repellendus voluptate laborum ipsum qui impedit.,1952,TV-PG,231,IM,2
37,Possimus voluptas voluptas.,Et aliquam sapiente eius sint totam corrupti rerum nihil nulla porro suscipit non autem ipsam.,1985,PG,146,SJ,4
38,Nemo et aut.,Quia qui nisi labore quia molestiae corrupti est blanditiis officia commodi modi perferendis molestiae vitae.,1966,M,196,VC,
39,Est quia aut.,Nisi ea eos veniam est ipsam sequi similique aut laboriosam omnis cum inventore rerum cupiditate.,1973,PG-13,179,ID,5
40,Asperiores incidunt fugit.,Explicabo sit reprehenderit aspernatur itaque molestiae nesciunt mollitia nostrum rerum molestiae aut consequatur alias suscipit.,1999,C,123,JO,
41,Quod aut nihil.,Voluptatem eos libero cum aut provident totam animi ut et enim dolore voluptatibus quasi laudantium.,2009,MA15+,106,MH,
42,Qui delectus cupiditate.,Et eligendi iste sint autem omnis aliquam voluptas error ut sapiente accusantium vero eum magni.,1986,E10+,143,CH,
43,Autem et non.,Ut explicabo et quibusdam non placeat itaque dolorem qui quasi aliquam aspernatur ut fugit quis.,1901,GP,101,CF,
44,Consequatur non et.,Debitis dolorum officia deserunt quia totam suscipit facilis vero delectus perspiciatis adipisci sequi sunt labore.,1917,C,170,KW,1
45,Illum omnis earum.,Ea rem a vel qui minima illum minus voluptas qui omnis ut delectus debitis eveniet.,1965,C,200,IR,
46,Est velit facere.,Quam sit veniam pariatur culpa et soluta delectus qui sit labore et unde aut quibusdam.,1997,R16,235,MD,8
47,Voluptates est enim.,Mollitia id aliquid accusamus fuga sunt ut harum numquam saepe nobis aspernatur eligendi id id.,1914,X18,75,TH,
48,Reprehenderit doloremque odit.,Repellendus et eligendi qui soluta quis laboriosam labore pariatur et repellat in dolorem esse quia.,1973,18,138,PG,
49,Quas rerum repellat.,Architecto praesentium mollitia veritatis aut qui deserunt sapiente autem maxime officia eum non eos nostrum.,1909,AL,194,VG,
50,Aliquam repellendus est.,Quaerat laborum repellat accusamus id maiores praesentium alias aut est aut possimus ad quia porro.,1910,12,239,MY,
51,Dolorum modi magnam.,Veniam dolor aut consequatur non accusamus repellendus quam voluptates accusantium quos quis quaerat doloremque dolor.,1987,EC,205,PF,
52,Debitis est eos.,Saepe cum quia non illo sunt enim est vel veniam iusto ut rerum nisi aut.,1960,MA15+,183,EE,
53,Non sint corrupti.,Vero architecto quam reprehenderit iste perferendis sit facilis temporibus sit eligendi animi in est iste.,1999,R18+,80,ZW,
54,Quia consequatur quia.,Amet consequatur enim autem odio nam natus quo ea sint incidunt est rerum dignissimos at.,1953,MA15+,104,MD,
55,Ullam voluptas beatae.,Quaerat impedit eius ipsa quos ut molestias doloremque odit accusamus sed optio ut aliquid dolor.,1931,18,192,AU,
56,Repellendus autem ut.,Illo asperiores nisi explicabo eum mollitia dolorem consequatur voluptatum similique optio excepturi dolor recusandae eos.,1922,M/PG,137,KE,2
57,Facilis minima quis.,In a molestias esse tenetur at quia dolorem ex facere non consectetur aut dolor perferendis.,1955,TV-PG,223,NF,
58,Sed consectetur et.,Amet saepe autem nobis et optio assumenda voluptatem facilis ad est minus quas et adipisci.,1942,15,60,LC,
59,Facilis ut modi.,Ut omnis et sapiente et sit similique repudiandae velit distinctio dolor tempora accusantium saepe eligendi.,1947,R18,87,AG,
60,Culpa fugit necessitatibus.,Distinctio cupiditate qui modi dolor quas saepe rem eum quis hic sint molestias sint velit.,1923,X18,131,CM,8
61,Reiciendis explicabo non.,Ab dicta velit unde est quia nihil placeat nesciunt cum consequatur architecto et repellat quibusdam.,1907,18R,234,CO,
62,Non praesentium numquam.,Commodi fuga aliquid sed et et earum ut possimus voluptates est quae perferendis vel vitae.,1910,CA,190,CW,
63,Ea et dolor.,A fuga animi consequatur maxime eligendi natus officiis placeat dolor qui mollitia labore nihil est.,1951,NC-17,177,AU,
64,Fuga sit impedit.,Esse beatae sit qui sint et sed quis libero et nulla quas et id alias.,1921,M/PG,70,US,
65,Quia sunt a.,Occaecati occaecati aut delectus laudantium nihil quisquam quasi ab molestiae facere qui ut commodi id.,1978,PG-13,112,AG,
66,Unde iure omnis.,Et magni rerum sint in ea non sit nihil omnis vitae perspiciatis reiciendis odio voluptate.,1935,GP,138,SG,
67,Quas molestias debitis.,Omnis et soluta itaque praesentium rerum aperiam alias culpa earum asperiores dolor ratione unde totam.,1962,R18,77,LB,
68,Magni animi rerum.,Corporis quae nostrum aperiam qui repudiandae voluptatem ipsam aperiam earum voluptas aut cumque minus perferendis.,1990,G,90,CI,9
69,Quia aut veritatis.,Quisquam ut enim quos sunt odit odit alias cupiditate quia et eum repudiandae odio qui.,1933,R21,63,SS,
70,Consequatur repellendus amet.,Commodi quia et quia mollitia qui molestias nemo magni voluptatem distinctio officiis recusandae aspernatur id.,2016,18,166,BR,
71,Minima occaecati iste.,Tempore et rerum tenetur vero laborum est odio voluptatem earum eius ut sunt qui est.,1963,S,119,LK,
72,Quis quas laboriosam.,Veritatis expedita illum hic porro provident autem omnis eos dolores nesciunt perspiciatis aliquam consequuntur quidem.,1920,TV-G,198,TD,
73,Aut illo consequatur.,Eos consequatur natus cum voluptatem possimus est quaerat et repellat eveniet aspernatur odio autem inventore.,2008,NC-17,205,LA,
74,Iste distinctio autem.,Et repudiandae dicta ullam id et ex veniam sed ut mollitia porro maxime perferendis tempora.,1999,T,161,PG,
75,Amet temporibus adipisci.,Iusto eveniet saepe fugiat vel et eum vel fugit perspiciatis voluptatem repellendus aut iste et.,1940,12,68,PR,
76,Veritatis qui quia.,Praesentium sit voluptas optio rerum debitis vel rerum qui quisquam eos ab dolorum dolor quasi.,1981,6,116,AU,
77,Iste dolores consequatur.,Mollitia ut culpa deleniti blanditiis quia consequatur repudiandae similique enim sit recusandae quia et fugiat.,2006,X18,141,RO,
78,Rerum sunt mollitia.,Reiciendis excepturi et cupiditate commodi et dolor nostrum asperiores est et ipsam nemo qui dicta.,1970,EC,114,CG,
79,At et dolor.,Est et consequatur eum eius quo error nulla exercitationem voluptas eum aliquid aut enim non.,1953,X18,227,KW,
80,Ut placeat sunt.,Reprehenderit aut ea ipsam et soluta et hic quasi ut officiis earum asperiores minus inventore.,2013,E,181,EG,
81,Ea soluta laboriosam.,Ipsum eum ut maxime quidem corrupti quaerat omnis sit odit sequi amet porro dolor nihil.,1906,AL,205,US,
82,Recusandae aut et.,Placeat exercitationem quas est esse quae eaque eius aut eligendi repellat quis ut facilis esse.,1916,PG,135,HN,
83,Eos ipsa neque.,Culpa a quasi accusantium asperiores maxime repellat laudantium corporis maxime eius consequatur molestias eum repellendus.,1939,GP,146,GD,
84,Magnam aut ut.,Minima reiciendis quis placeat et sit et ad temporibus quo voluptatem velit omnis autem ad.,1965,12,126,MF,
85,Ut facilis beatae.,Ab eaque veniam autem tempora voluptatum voluptatem culpa sint eum sunt et ut voluptas repudiandae.,1940,C,141,HN,
86,Quam quam officiis.,Et accusantium praesentium aliquid sapiente est facilis delectus exercitationem deleniti aut excepturi ut dolorum error.,1902,M/PG,148,AW,6
87,Soluta omnis deserunt.,Provident sed qui nostrum explicabo at repudiandae exercitationem aliquid recusandae qui deleniti esse laborum accusamus.,1936,9,90,NP,1
88,Adipisci veritatis consequatur.,A exercitationem deserunt eius nesciunt quia qui deleniti pariatur voluptatum voluptas itaque odit quis similique.,2013,AL,129,PW,
89,Ullam esse excepturi.,Fuga labore aut temporibus qui sit architecto deleniti ut laudantium cum ab voluptatum reprehenderit veniam.,1990,M/PG,160,ME,
90,Eum quo explicabo.,Voluptas reprehenderit libero dolores est harum est ut et quam consequuntur ipsa id qui et.,1966,U,142,EG,
91,Tempore autem qui.,Officiis cupiditate aut et perferendis omnis commodi expedita tempore quisquam occaecati quia beatae id vero.,2000,E,195,VN,
92,Modi sit consequatur.,Odit rem dignissimos est aut doloremque quibusdam aperiam quisquam fuga facere architecto nesciunt ipsam distinctio.,1956,NC-17,112,SL,
93,Ipsum optio fugit.,Temporibus aliquid et inventore blanditiis voluptas quia vel voluptatem consequuntur numquam corrupti harum quas aut.,1983,PG-13,195,SK,
94,Laudantium dolor quasi.,Fugiat voluptate repellendus eos nulla illo nulla veritatis odit sit laborum voluptatem iusto repellat ut.,1972,18R,143,LB,6
95,Cum quia dolores.,Commodi unde aliquam cum soluta ut praesentium aut cum provident sapiente enim est laudantium minima.,1923,S,184,SI,9
96,Soluta voluptatem sed.,Accusantium quia esse laudantium non molestiae rerum voluptas et id rerum repellat voluptatem in autem.,1974,R,230,BW,
97,Quae vitae animi.,Quis sed esse dolor qui officia illum voluptates nesciunt minus aut porro qui quia quod.,1959,12A,125,SG,
98,Dolores quae non.,Et cum qui accusantium eius rerum esse et vel eum ex ratione totam illum neque.,1999,U,156,ST,
99,Nihil aperiam veritatis.,Nihil vel cumque facilis placeat fugiat qui commodi enim quis aut nisi placeat nisi nobis.,1966,S,141,IM,
100,Nihil iure consectetur.,Minus sed ad ut at quibusdam et perspiciatis sint voluptatum velit qui odio et dolores.,1991,R,234,LA,
